{
  "$schema": "https://json-schema.org/draft/2020-12/schema",
  "$id": "https://zyra.dev/schemas/voice-agent/resume-delta.schema.json",
  "title": "Zyra realtime resume delta",
  "type": "object",
  "required": [
    "schema_version",
    "delta_id",
    "conversation_id",
    "base_packet_id",
    "from_context_version",
    "to_context_version",
    "from_watermarks",
    "to_watermarks",
    "changes",
    "safety_state",
    "critical_records_complete",
    "canonical_sha256",
    "generated_at"
  ],
  "properties": {
    "schema_version": { "const": 3 },
    "delta_id": { "$ref": "common.schema.json#/$defs/id" },
    "conversation_id": { "$ref": "common.schema.json#/$defs/id" },
    "base_packet_id": { "$ref": "common.schema.json#/$defs/id" },
    "from_context_version": { "$ref": "common.schema.json#/$defs/contextVersion" },
    "to_context_version": { "$ref": "common.schema.json#/$defs/contextVersion" },
    "from_watermarks": { "$ref": "resume-packet.schema.json#/properties/source_watermarks" },
    "to_watermarks": { "$ref": "resume-packet.schema.json#/properties/source_watermarks" },
    "changes": {
      "type": "array",
      "minItems": 1,
      "maxItems": 256,
      "items": {
        "oneOf": [
          {
            "type": "object",
            "required": ["change_type", "record"],
            "properties": {
              "change_type": { "const": "context_revision" },
              "record": { "$ref": "context-revision.schema.json" }
            },
            "additionalProperties": false
          },
          {
            "type": "object",
            "required": ["change_type", "record"],
            "properties": {
              "change_type": { "const": "foreground_route" },
              "record": { "$ref": "foreground-route.schema.json" }
            },
            "additionalProperties": false
          },
          {
            "type": "object",
            "required": ["change_type", "record"],
            "properties": {
              "change_type": { "const": "attempt_event" },
              "record": { "$ref": "attempt-event.schema.json" }
            },
            "additionalProperties": false
          },
          {
            "type": "object",
            "required": ["change_type", "record"],
            "properties": {
              "change_type": { "const": "task_event" },
              "record": { "$ref": "task-event.schema.json" }
            },
            "additionalProperties": false
          },
          {
            "type": "object",
            "required": ["change_type", "source_sequence", "record"],
            "properties": {
              "change_type": { "const": "decision_request" },
              "source_sequence": { "type": "integer", "minimum": 1, "maximum": 9007199254740991 },
              "record": { "$ref": "decision-request.schema.json" }
            },
            "additionalProperties": false
          },
          {
            "type": "object",
            "required": ["change_type", "source_sequence", "record"],
            "properties": {
              "change_type": { "const": "approval_request" },
              "source_sequence": { "type": "integer", "minimum": 1, "maximum": 9007199254740991 },
              "record": { "$ref": "approval-request.schema.json" }
            },
            "additionalProperties": false
          },
          {
            "type": "object",
            "required": ["change_type", "source_sequence", "record"],
            "properties": {
              "change_type": { "const": "capability_lease" },
              "source_sequence": { "type": "integer", "minimum": 1, "maximum": 9007199254740991 },
              "record": { "$ref": "capability-lease.schema.json" }
            },
            "additionalProperties": false
          },
          {
            "type": "object",
            "required": ["change_type", "source_sequence", "record"],
            "properties": {
              "change_type": { "const": "operation_intent" },
              "source_sequence": { "type": "integer", "minimum": 1, "maximum": 9007199254740991 },
              "record": { "$ref": "operation-intent.schema.json" }
            },
            "additionalProperties": false
          },
          {
            "type": "object",
            "required": ["change_type", "source_sequence", "record"],
            "properties": {
              "change_type": { "const": "narration_delivery" },
              "source_sequence": { "type": "integer", "minimum": 1, "maximum": 9007199254740991 },
              "record": { "$ref": "narration-delivery.schema.json" }
            },
            "additionalProperties": false
          },
          {
            "type": "object",
            "required": ["change_type", "record"],
            "properties": {
              "change_type": { "const": "conversation_message" },
              "record": {
                "type": "object",
                "required": ["message_id", "conversation_sequence", "role", "modality", "foreground_route_id", "route_epoch", "canonical_commit_receipt_id", "content", "created_at"],
                "properties": {
                  "message_id": { "$ref": "common.schema.json#/$defs/id" },
                  "conversation_sequence": { "type": "integer", "minimum": 1, "maximum": 9007199254740991 },
                  "role": { "type": "string", "enum": ["user", "assistant"] },
                  "modality": { "type": "string", "enum": ["text", "speech", "image", "multimodal"] },
                  "foreground_route_id": { "$ref": "common.schema.json#/$defs/id" },
                  "route_epoch": { "type": "integer", "minimum": 1, "maximum": 9007199254740991 },
                  "canonical_commit_receipt_id": {
                    "oneOf": [
                      { "$ref": "common.schema.json#/$defs/id" },
                      { "type": "null" }
                    ]
                  },
                  "content": { "type": "string", "maxLength": 20000 },
                  "created_at": { "$ref": "common.schema.json#/$defs/timestamp" }
                },
                "allOf": [
                  {
                    "if": { "properties": { "role": { "const": "assistant" } }, "required": ["role"] },
                    "then": { "properties": { "canonical_commit_receipt_id": { "$ref": "common.schema.json#/$defs/id" } } },
                    "else": { "properties": { "canonical_commit_receipt_id": { "type": "null" } } }
                  }
                ],
                "additionalProperties": false
              }
            },
            "additionalProperties": false
          }
        ]
      }
    },
    "safety_state": { "$ref": "resume-packet.schema.json#/properties/safety_state" },
    "critical_records_complete": { "const": true },
    "canonical_sha256": { "type": "string", "pattern": "^[a-f0-9]{64}$" },
    "generated_at": { "$ref": "common.schema.json#/$defs/timestamp" }
  },
  "additionalProperties": false
}
